reviewId,userName,userImage,content,score,thumbsUpCount,reviewCreatedVersion,at,replyContent,repliedAt,appVersion
fe76075f-d52e-4203-a77f-9e65b9bf8b82,J S (Jewlzzz),https://play-lh.googleusercontent.com/a-/ALV-UjVQVXCSRhm-XafnIUapRyhH0bYJvKE8bRivmzDW5Y5wZ6MVO4o,"Edit to add: I would like the app to prompt with unwatched videos. I know they are there. I'd like a ""can't watch this now"" (due to surroundings or activities) so that the app can prompt again with unwatched videos. I've just started one that was ""congratulations for reaching the end"" ... I think I only watched the first one.",5,16,0.0.349,2024-12-30 23:03:27,"Thank you for taking the time to review the app! Here is how to find those suggested videos: Go to the Check in tab, scroll down to see your list of past check-ins, weekly reviews, and suggested lesson videos. You can also view all the lesson videos by tapping on the Tools tab and tapping on the Emotions 101 category.",2024-12-27 21:02:01,0.0.349
eb855c49-9852-4534-9914-49253012d579,Naomi Elizabeth de Wal,https://play-lh.googleusercontent.com/a-/ALV-UjUeilOWPT4LE1BBeGmwnCT5Yf7L9XexKaF31BUkQwpA-Y96X-DoNQ,Best app ever,5,0,0.0.349,2024-12-30 21:16:24,Thank you so much for your review! Please share the app with family and friends :),2025-02-19 23:37:26,0.0.349
e767a88d-3324-4fea-a97f-3c9b1c6576fe,Wes Portugaels,https://play-lh.googleusercontent.com/a-/ALV-UjVCxqNTOVD8-pAk1GXlE2dUi9-dP8qE70naLktWApdzApfsEzYG6A,"Essential for my mental health. I really love this app, and the AI features made it even more perfect.",5,0,0.0.349,2024-12-30 20:05:31,"Thanks for your review! Please recommend our app to your friends, and don’t hesitate to shoot us a note at support@howwefeel.org if you have any questions.",2025-02-19 23:37:13,0.0.349
a5130546-8ece-4577-9c59-9a9fbeddbba3,kimani kennedy,https://play-lh.googleusercontent.com/a-/ALV-UjVl9U3r2i8V08jDa0Q9xm6d0jbj7c6wlbD9DWvJwtVn9Q6bCMrE,"I love this app so much as someone who usually isn't in touch with their emotions it's given me the chance to name my feelings and the tools to navigate them and the app is so easy to navigate through it keeps track of everything so you can learn your patterns in how certain things effect your emotions, like the weather time of day who your with or the things you've done that day.",5,0,0.0.349,2024-12-30 18:42:54,Thank you so much for your review! We're adding more data to track with each check-in. Please share the app with family and friends :),2025-02-19 23:36:59,0.0.349
d99f6af9-df07-4019-86cb-5a3b55d73f53,Nina v,https://play-lh.googleusercontent.com/a/ACg8ocKFLpLXWDhAwW7-As4KjkTdybhxOdPdYKZfYqEvHlJygmNN3w=mo,I really like the large amount of trackable emotions and the insight thats provided. A great addition would be an overview of your emotions on a monthly basis. It could help track emotions in relation to periods and different mentrual stages.,4,0,0.0.349,2024-12-30 17:34:30,Thank you for providing your valuable feedback! We're working on a monthly review feature.,2025-02-19 23:36:06,0.0.349
0cbc8a4a-59fb-4be0-bc24-71ae62428608,Dian Isnariadi W.,https://play-lh.googleusercontent.com/a-/ALV-UjWhQ_8yni8P5b_8t-WD_UI60J_656UWB8zvg3H-esLev5DBtw5LvQ,"Asli sih, aplikasi kayak gini penting banget dan bantu banget dalam ngertiin mood apa yang sedang dialami kita. Apalagi mood yg ada itu banyak banget, jadi bisa detail bangetlah. Dan, fitur beta berupa AI ini ngebantu banget. Aku harap bakalan tetep gratis kedepannya. Thanks a lot for HWF team ♥️.",5,0,0.0.349,2024-12-30 13:26:03,Thank you so much for your review! Please share the app with family and friends :),2025-02-19 23:35:17,0.0.349
65dcf9db-e98b-47d5-868f-ce3c701aa74e,Mirella Martonosi,https://play-lh.googleusercontent.com/a/ACg8ocI9vb6cPHotGOTvWrHWxNBuZospGySCElPTUuQ4Jjx2x7qY_w=mo,Very good and useful app.,5,0,0.0.349,2024-12-30 12:35:03,Thank you so much for your review! Please share the app with family and friends :),2025-02-19 23:35:01,0.0.349
bf3d211d-2014-4359-82ad-8643f84b1f53,Jakub Mintal,https://play-lh.googleusercontent.com/a-/ALV-UjVr47LxFKLYV3uiCf7EGZUg5n4tWPFGLEzmMGoSScnLJLP4-eDp,"I don't understand, how knowing emotions could possibly help me, if no one cares. Used the app few months, no changes in my life.",2,0,0.0.343,2024-12-30 07:07:48,,,0.0.343
75c4fbc0-f34c-42e3-8244-7c458cee7413,Leon Van Der Meer,https://play-lh.googleusercontent.com/a/ACg8ocK7mEQYQN75cbDYI_4OB_Lo7rEba-uuH11aXImBHDVoiUQXMA=mo,"It's the best thing since sliced bread! Ive been journaling for years and only had 5 emotions to go off (great,good,ok,upset,bad) and been tricky to remember how I feel each day. this is naming and shaming each emotions and making it clear on how I've felt throughout the day! The ai system is great its like a free therapist!!! I think this app may have saved my life! I recommend this to everyone even my therapist",5,3,0.0.349,2024-12-29 22:19:14,"Thanks for your review! Please recommend our app to your friends, and don’t hesitate to shoot us a note at support@howwefeel.org if you have any questions.",2025-02-19 23:34:07,0.0.349
73c9436a-df67-48c5-9ce8-9d5c530c8e00,Sean McKay,https://play-lh.googleusercontent.com/a-/ALV-UjXeYFAYGqTIlcXFwSTKEAiPi6CbYcD_zE0h1y6CWNJsJ3ykWY23,"Best mood tracking app out there, without question! The recent updates to quick save have removed a huge amount of friction (especially when combined with health connect stats). The only major friction point remaining that keeps me from tracking more often is that the app really needs an optional toggle to *always* share with friends, rather than asking every time.",4,10,0.0.349,2024-12-29 20:22:43,Thank you for your kind feedback. We recently shipped a feature to default your share settings! Please update your app to the latest version.,2025-02-19 23:33:47,0.0.349
a3553ed0-f780-419e-88e0-b52d9a13cee8,K,https://play-lh.googleusercontent.com/a/ACg8ocLQcxR5O1l-A7M8QcdJ7uK1t75nEwxEhBCI7XEqQBsS0QfiT6gP=mo,This app has a special place in my heart. I have a hard time expressing myself and understanding how I am feeling in the moment. It's great having the vocabulary to break this down. I love the use of the mood meter - It helps me understand my mood intensity alongside the positivity/negativity. I think the AI features add to building on my emotional literacy.,5,2,0.0.349,2024-12-29 16:25:42,"Thanks for your review! Please recommend our app to your friends, and don’t hesitate to shoot us a note at support@howwefeel.org if you have any questions.",2025-02-19 23:32:54,0.0.349
323bb7d5-ae66-4a0a-98a3-332b8ecbadbe,Diogo Ribeiro,https://play-lh.googleusercontent.com/a-/ALV-UjWl8nAiurRCuzTdDk_pkCs0azqew5cEk7SyOLqUpaA5PCEUealu,this app is having a significant positive impact in my life. i am deeply grateful to the people who are building it. it is very well done. please keep it free. it has the potential to help so many people.,5,0,0.0.349,2024-12-29 14:19:33,"Thanks for your review! Please recommend our app to your friends, and don’t hesitate to shoot us a note at support@howwefeel.org if you have any questions.",2025-02-19 23:32:33,0.0.349
422c9d10-42a2-46fc-a25b-07dd79bda943,Harsh Padiya,https://play-lh.googleusercontent.com/a/ACg8ocKXBYWG7zN7QxPg8zmWglo2C4k4yxxBJ8HXRIIcLl1kC5CQ4A=mo,"Just excellent I can't believe all the features of this app are available for free!! Thank you and huge respect to the devs of this app , would've given more than five starrs if i could hahah , HIGHLY RECOMMEND to anyone who wants to keep their emotional cycle tracked as well wants to journal a little and there's so much more. go ahead and download :)",5,0,0.0.349,2024-12-29 12:13:19,Thank you so much for your review! Please share the app with family and friends :),2025-02-19 23:32:19,0.0.349
5fb763c1-1a29-4819-b2de-47fed2496d08,Julie,https://play-lh.googleusercontent.com/a-/ALV-UjV2IdvZAu7CDQB480b9lqqNRSiFUpQYzr3XWCjFtRNQ4HthFY0r,"I love how this app is free and so good. There are no ads or microtransactions so far and it's really helpful. I'm so glad it's free to use all it's features. I just wish you could ad more than 2 emotions per check in, sometimes a feeling is so complex that it needs more than 2 labels to describe it. But overall, this app is wonderful.",5,21,0.0.349,2024-12-29 04:29:48,Thank you so much for your review! Please share the app with family and friends :),2025-02-19 23:32:04,0.0.349
9eb16358-baf9-4d96-a473-7628294114a1,Jessica Twardowski (Celebi),https://play-lh.googleusercontent.com/a-/ALV-UjWouhxFxgGB6_H91YkV4LDit9CJ-TGWHu32xr0Q6s0_OW-ObdM,"This app has been instrumental in helping me manage my mental illness symptoms. It challenges me to put words to what I'm feeling in the moment, to process it, to take steps to improve it, etc. The brief ""descriptions"" of emotions on the ""search"" lists are extremely helpful for identification. I also just discovered the ""reflect"" feature on emotion logs which is a powerful exercise for me. Lastly, I greatly appreciate the weekly insight wrap-up. It helps me get a solid grip on my progress.",5,24,0.0.349,2024-12-28 18:51:54,Thank you so much for your review! Please share the app with family and friends :),2025-02-19 23:31:44,0.0.349
c0366ea4-4d95-4b06-a5e9-c9a7a2beeec8,Jo Magnus,https://play-lh.googleusercontent.com/a/ACg8ocKhXIbuwbXrACqxODXOBnE2FZ9uJHhcngD8_WO-TkajovnCLg=mo,Really helped me to identify and name my emotions. Absolutely the best app to increase your emotional intelligence and awareness. Also good for keeping track of your emotional wellbeing. And for free? Can not recommend enough. Only wished i would've found it earlier in my life,5,0,0.0.349,2024-12-28 09:25:56,Thank you so much for your review! Please share the app with family and friends :),2025-02-19 23:31:07,0.0.349
1568237a-4b41-4737-b72c-9207353788eb,Sarick Shah,https://play-lh.googleusercontent.com/a-/ALV-UjXTQkZf3RJzQziLtd-uQ92ZXVeTBQxuDf81FMTUQsIx9ev4kOst,"Great app, just not sure why it's not pulling my health connect data like sleep which is synced via fitbit",4,0,0.0.349,2024-12-28 07:47:48,"Hi, thank you for the review. If the Fitbit data is synced to Android Health Connect, then the values should display in How We Feel. Please contact support@howwefeel.org and we'll look into the issue.",2025-02-19 23:30:29,0.0.349
f547d71d-a4c4-4d2a-b1f3-8dc6ecf46318,Jakbin Alsaleh,https://play-lh.googleusercontent.com/a-/ALV-UjXSCeHfxrhzTvWF9jT5Fo7T0t06ol3NaUjTG6w9wKTQUX8J0keu,I would add mixed emotions and feeling.,5,0,0.0.347,2024-12-28 00:39:42,"Hello, you can select up to two emotions on a single check-in. Here is how: Select an emotion to check-in -> on the view where you apply tags, tap on the '+' icon in the upper right corner. Thanks for taking the time to review the app!",2024-12-27 21:02:58,0.0.347
b8b112a9-bef5-4005-bbfd-2d4018c23979,Ruby Thompson,https://play-lh.googleusercontent.com/a/ACg8ocI1xveADWiYERZxSrarmNSsXVMVBzET2SIbdIRiUMIucf1soYM=mo,"I downloaded this app four days ago after my friend's therapist had them get the app, and then they recommended ME to get the app. It is so helpful, and I just love every aspect of it. Sometimes it feels like apps like this are trying to make money, not get the research needed in their cause, or help me, but this one is wonderful, AND it is free. This app has already helped me a lot. I didn't know I could feel this many emotions. And the whole splitting it into 4 groups is also very helpful",5,0,0.0.347,2024-12-26 19:34:25,Thank you so much for your review!,2024-12-27 21:02:15,0.0.347
8da703f8-84bb-41ad-a96c-f8fc042a3bca,Dima,https://play-lh.googleusercontent.com/a-/ALV-UjXLeSwrx5Jg0pUUVQXB2PQfBKzxRiO2wxWOoFARhTCtg4EoLLnM,This is an incredible app. It helps me take inventory throughout the day and makes journaling easier. This was recommended by my therapist and I am grateful.,5,0,0.0.347,2024-12-26 03:45:18,Thank you so much for your review! We have an awesome (and optional) AI-powered journaling feature in the next release. Please check it out!,2024-12-27 21:03:44,0.0.347
157cb58e-c25a-4e8b-8ece-e476c58a879b,Keron,https://play-lh.googleusercontent.com/a-/ALV-UjVgThu4vyf2--4JEcRbX1yV00tkhMF7ik8x7H755vzL2vz3nbI,Best app there is,5,0,0.0.347,2024-12-25 16:54:53,Glad you like it! :),2024-12-27 21:03:58,0.0.347
db818ea7-c1e8-46bb-8fc5-256cb024d7d2,Kalana Sandaruwan,https://play-lh.googleusercontent.com/a-/ALV-UjXqLK60uwKXJ-uWnRjIO6bT7K0_XlKId6rGPNpa3Yk5c84ZimTP,So far this has been a wonderful app. It's hard to believe it's free.,5,1,0.0.349,2024-12-25 04:18:29,Thank you so much for your review! Please share the app with family and friends :),2024-12-27 21:04:34,0.0.349
ac6d603c-bf28-43c3-8c8f-3ca64a9b1ccc,Jeff Swoboda,https://play-lh.googleusercontent.com/a-/ALV-UjXFe35-kYWEtMZExcY65K4GInL-eSiYkFY0tVqQfRdU8cseysuteg,"This itemized language of feeling tries to simplify something much more complicated. Also some of these emotions can be both pleasant or unpleasant in different contexts. Mediocre app with generic self help shorts, but gets one star (and uninstalled) because they just started advertising AI generated content, which is absolute brain poison",1,1,,2024-12-24 13:55:48,"The grid of emotions on the Check in tab is our representation of the Mood Meter, which is “a tool to build greater emotional awareness that was built based on decades of research on the circumplex model of emotion.” The rest of this review regarding adverstising AI generated content is off topic and untrue.",2024-12-27 21:06:30,
b416a724-55c7-412d-9481-f360954463c5,Stefany Lewis,https://play-lh.googleusercontent.com/a/ACg8ocLDpSgsRTGWmdTRApBEqUqVoGl2GaaHnUXP3_vZpSgecekC4w=mo,"I used to like this app a lot until I decided to not use it anymore I deleted all my previous moods, there's no save data and no log outI decided to delete the app and download it again I didn't even need to login and I saw all my pervious moods that I thought I had deleted before Uninstaller the app there is no way to permanently delete moods or data you put in the app creepy! no it does not I JUST logged in and saw all pervious Data I thought I deleted back up again on my page your lying!",1,1,0.0.347,2024-12-24 10:11:14,"This is incorrect information. The data is stored on your device, so when you delete the data (or app) it removes the data from the app.",2024-12-23 19:56:54,0.0.347
cf1b35c4-35e6-4661-a100-37d234710ed6,Kelsey Hinote,https://play-lh.googleusercontent.com/a-/ALV-UjVYlC5DtuFQNd6bzHJbW-BppH1TsrXwhtcflP7So22Z-njd2MA7,It's free to do how u feel and write them down and do the sessions like I wish it was easy to find an app that u can post on for free like mental health apps that are social media even tho they ain't like this one some mental health apps are just money hungry but not this one or talk life even tho talk life got some locked stuff,5,0,0.0.347,2024-12-23 23:13:20,Thanks for your kind feedback. We have some exciting updates on the way!,2024-12-27 21:08:36,0.0.347
187addcd-9b13-4453-bd8a-a365291bd0e3,Z,https://play-lh.googleusercontent.com/a-/ALV-UjUfN3AJon-5pflLuycNX2RCGvFD3LBzSrdZGyw485mF4XFNsD_T,This app is simple and easy to use. It offers a wide range of potential emotions to keep a more accurate track of how you feel and is overall great. I would highly recommend!,5,0,0.0.347,2024-12-23 21:01:13,Thank you so much for your review!,2024-12-27 21:08:46,0.0.347
fe8e44c3-0b76-4e51-810e-07eccb22319e,C R,https://play-lh.googleusercontent.com/a/ACg8ocK_3y4Ada6YdiiBA1FkzkBU_KGabYUt3MpgWP0m9pAWGifB1Xk=mo,Excellent app!,5,0,0.0.347,2024-12-23 14:59:56,"We are pleased that you enjoy the app. If there is anything we can do for you, just let us know at support@howwefeel.org.
Have a wonderful day!",2024-12-23 19:30:27,0.0.347
44538be0-3816-49b4-8c10-50beac3f73e6,Paper,https://play-lh.googleusercontent.com/a-/ALV-UjX8WHwPAsz1WpG-3afmLtaL6e-2LVcuaA3L0mGod1oG2M2bnwul,"Is there such a thing as ""grey"" moods? Not negative or positive, somewhere in the middle? I'd love to see more moods added, maybe in a ""grey area"". The app helps identify my moods and emotions really well and I find myself subconsciously doing the exercises by myself when I notice changes in my mood. It doesn't overwhelm you with questions which I really like. It's a really chill therapy companion, and it encourages you to check in daily in a gentle non-obtrusive way which is really nice.",5,0,0.0.347,2024-12-23 10:06:45,"The moods toward the center of the Mood Meter are more neutral. Thank you for providing your valuable feedback. Please reach out to us at support@howwefeel.org, if you have other suggestions.",2024-12-23 19:32:44,0.0.347
93b2ec0a-c431-4b13-bcde-00718bd82b2a,legeju,https://play-lh.googleusercontent.com/a-/ALV-UjVKE8MyYa8NT0b_G3QjmmcygtPiFLhJQbwqHIctW24YJJPR4Mgd,very well thought through app for raising awareness and emotional intelligence!,5,0,0.0.347,2024-12-22 19:12:06,We greatly appreciate the review! We have an exciting update coming in the next version of the app. Be on the lookout for updates in the Play Store this week!,2024-12-23 19:36:30,0.0.347
c83fa32e-a914-4909-b1ed-e1bdea6d5cd8,Fiona W,https://play-lh.googleusercontent.com/a/ACg8ocJ8-aWZc2uk3NxcMBajahg_97qpEX9o7hzpixWybjyQl6H7gA=mo,"Was looking forward to trying this app out, but its unuseable. It glitches out on the second page of the check-in (""Describe why you might be feeling X"").",1,2,0.0.347,2024-12-22 00:59:28,We apologize for the inconvenience. Please reach out to us at support@howwefeel.org so that we can troubleshoot the issue.,2024-12-23 19:40:02,0.0.347
cc8ce3af-03d3-46e9-b462-b429d84e8a55,Bryan Bitas,https://play-lh.googleusercontent.com/a-/ALV-UjWlYWVxcjevHGhvOOpvT4UIPpIGHLdfgPV9bys8JlJWGftR8YsULg,"I love the app! It's my most used frequently used app these past few weeks, but since then, I'vegotten my wife, who is an iPhone user to using the app. I am so jealous of her AI features for the writing! Please PLEASE being it to android sooner than later too! 🙏🏽",5,0,0.0.347,2024-12-22 00:04:33,Thank you so much for your review! The Reflect feature is in the next version of the app and should be available this week!,2024-12-23 19:40:44,0.0.347
2b88104a-9802-423d-b17e-70355c64f01b,Ella Mae Lopez,https://play-lh.googleusercontent.com/a-/ALV-UjUvCvmjFGfpxQuvtjIhZu2SWojX15Gy665gSJWOTOSY7zdBbZ4,"as someone who is often overwhelmed by emotions, this app is very helpful in tracking and managing my emotions. thank you for this",5,0,0.0.347,2024-12-21 10:23:56,"We are pleased that you enjoy the app. If there is anything we can do to improve the experience, just let us know at support@howwefeel.org. Have a wonderful day!",2024-12-23 19:42:11,0.0.347
1a69c2b2-cb26-49f4-8677-e6879f147418,Aditya Jhalani,https://play-lh.googleusercontent.com/a-/ALV-UjUpcLQ7H2uUwHwvyIK0lZIB75AC2nshUJw69JbqFj2Z7tbI_vux,I have been using this app for only a week and half but I absolutely love everything about it. The whole premise - the idea of checking in emotions and like selecting these different shapes. The animations and the tools that they offer. It's all very thoughtful and beautiful thank you so much for creating it.,5,3,0.0.347,2024-12-20 12:22:39,Thank you so much for the kind words. We feel encouraged! We have an exciting update coming in the next version of the app. Be on the lookout for updates in the Play Store this week!,2024-12-23 19:52:01,0.0.347
9856314b-5b9b-4023-b091-90244e98d7ed,Fran U,https://play-lh.googleusercontent.com/a-/ALV-UjWOQXNNcHlNiyzs1i56-lv6E9RcBmnUMIlGGUqaSpZragdxJuBR,"This is a great idea, but there are no instructions, it's not intuitive, and the ""help"" is non-existent.",1,1,0.0.347,2024-12-20 00:49:33,"Hello, the issues you mentioned need more detailed explanation to receive support. Please reach out to our team at support@howwefeel.org. We are always looking to help our community.",2024-12-23 19:53:14,0.0.347
8c12d5b1-212f-4107-9a89-ab120b87e433,Madeline Grubb,https://play-lh.googleusercontent.com/a-/ALV-UjWku4jjMyGnhu7FT0cccJ6nQF6dScKeAITE9K1D1AZK93FxXG6KGg,I really wish there was a smartwatch version!,4,0,0.0.347,2024-12-20 00:27:12,"Thanks for writing a review! We're always looking for ways to improve the experience. If you have any more suggestions, then please reach us at support@howwefeel.org.",2024-12-23 19:54:07,0.0.347
ec66a98a-d00c-48d9-9fce-1d3d34f7f030,omivhs ༄,https://play-lh.googleusercontent.com/a-/ALV-UjUMmIm33hWbbLJPbdUuw78CQ0aCsmeAjAcrkydwocdNiaIp4CoR,Perfection ✨,5,0,0.0.347,2024-12-19 17:24:44,Thank you very much for your 5-star review!!!,2024-12-23 19:57:14,0.0.347
65581e75-70fe-4bc4-aa91-fe62a549bc24,Z L A,https://play-lh.googleusercontent.com/a-/ALV-UjXknn6XEoCArwDWntdsTPquitAuvbUDZYdWv-FfgGLuinLhe38,Great app,5,0,0.0.347,2024-12-19 12:21:30,Glad you like it! :),2024-12-23 19:57:26,0.0.347
52edcf7e-54ba-492c-bc0e-6d4e109ed11f,Ga Bi,https://play-lh.googleusercontent.com/a-/ALV-UjUrea4FvWLDlUKclK-XUoPSkICeoBK9sZv0U1ymf-eL4dVn1BfL,"This was an amazing app. Now everytime I click to publish my set emotion it glitches and doesn't proceed to save it, getting stuck on the same screen.",2,1,0.0.347,2024-12-19 10:52:57,Thanks for writing a review. We believe we can help resolve this issue. Will you share more information with our team at support@howwefeel.org?,2024-12-23 19:58:03,0.0.347
92b1ead6-fb70-4645-ad46-03ce2b41a626,Angela No,https://play-lh.googleusercontent.com/a/ACg8ocJR4n_JqmeT8UtHNkNV9fkheIhqsc9gC0ZHkt-S0IZJwBXonW0=mo,Going to try can't bookmark,3,0,,2024-12-19 02:34:28,Thanks for taking the time to let us know. Will you share more information with our team at support@howwefeel.org? We'll troubleshoot the issue and get it resolved.,2024-12-23 19:58:46,
9e156498-4e99-4290-a0cd-70e9c93c7f56,Josh Price,https://play-lh.googleusercontent.com/a-/ALV-UjXfPQVVVxntBHaGk2O8DYkFo6IhDzHf-JJn18l9M5hlboWCW0J54w,"I really like this app. I like the breadth of emotions readily available to choose from, as opposed to something like Daylio where I have to come up with all of the emotions (and must pay to have more than 5 default). However I wish there were a ""neutral"" mood category. Also I think the analysis tab should have more charts available, and maybe have them all use a percentage format instead of some having the weird disc-bar graph thing. Not useful. Some of the analyses aren't useful at all either",3,17,0.0.347,2024-12-18 20:50:01,"Thank you for providing your valuable feedback. Please reach out to us at support@howwefeel.org, if you have other suggestions. The emotions toward the center of the Mood Meter are more neutral with respect to their quadrants. We're looking at improvements to the Analyze tab.",2024-12-23 19:59:49,0.0.347
23ff9592-2fd3-4998-be49-f074943d1e73,Elliot,https://play-lh.googleusercontent.com/a-/ALV-UjXXEP8q1gR_PKINtpA8sdfyOLLFuKLKsP_IhwAkokqIcrR_rY-G,"I love this app. Everything about it is so beautifully and thoughtfully designed. The UI is sleek and the language used (in-app and in the videos) is sensitive. I love how I can get immediate suggestions for tools to try, as well as notice long-term trends in my emotions. I also appreciate the highly customisable sharing options. Thank you for this resource, more people should try it!",5,3,0.0.347,2024-12-18 15:30:00,Thank you so much for your review!,2024-12-23 20:00:11,0.0.347
a87b0bdc-fde6-48d0-a10a-a97e2bdd518a,Anaïs gn,https://play-lh.googleusercontent.com/a-/ALV-UjUVXrQsvtCS3wyXhjqhVgjr9gKrfBskjLCyTaej3kj1PckDLniW,"very good it would be nice tho to not get the share popup every time, as it may feel annoying, and make it part of the emotion description UI or something similar also, it'd be nice too to have a graph like the one with all the emotions you felt that shows more check-ins :)",4,0,0.0.347,2024-12-17 12:22:37,Thank you for providing feedback. We are working on a way to adjust the friend popup. Please reach out to us at support@howwefeel.org to share more information on the other requests.,2024-12-27 20:19:30,0.0.347
022aa478-d857-43cd-b4f7-f589d9124b23,Memeaw,https://play-lh.googleusercontent.com/a-/ALV-UjWFJzxIw2q9_sFvaUOf-ZpfZUVbOlX3adkqXr3MzCGkKYK7PqM,"I like this app. It's going to really help me better understand my emotions and the factors around them. So far, I'm really happy that there are no in-app fees or subscriptions for such a great app. I really hope it continues to meet my expectations",5,1,0.0.347,2024-12-17 08:04:44,Thank you so much for your review!,2024-12-27 20:19:48,0.0.347
c8680c1b-256f-4d5a-9b7b-4cabecbfa378,Sreelaya S,https://play-lh.googleusercontent.com/a/ACg8ocIfV9Lc3DS67tOtbsKKnfscchcBSKB6IBzVVNUzyagNQhIZu8s=mo,I really loved this app. It was more of like a Journal. I accidentally signed out from the app and all my data is gone. I couldn't retrieve any data even though I signed in. Please help me to recollect my data again. It meant a lot to me and it aches my heart to have lost it.,5,0,0.0.347,2024-12-16 09:03:27,"Hello, please connect with us at support@howwefeel.org and we'll do our best to help.",2024-12-27 20:22:35,0.0.347
02cb6544-4d7c-4807-bfb2-eeeb3ff7874d,Akeem Walters,https://play-lh.googleusercontent.com/a-/ALV-UjX-HcLUSJRKcH30gHN-63-Ka3W0JCpsMeyNYRIHyli9xoty_GyETA,Amazing,5,1,0.0.347,2024-12-16 01:33:40,Glad you like it! :),2024-12-27 20:22:52,0.0.347
ab9824f2-145f-4c52-9efd-7699d218fc4f,suma chatni,https://play-lh.googleusercontent.com/a-/ALV-UjVveBNDu_g97QGI9A9EFztlopeICkAHvANKo5jjt450jenvpwGD,It's such a beautiful app... A blessing for everyone who wants to take care of their mental well being... Thanks a lot for the app being free and rich with features... ☺️,5,1,0.0.347,2024-12-15 23:37:53,Thank you for your encouraging words!,2024-12-27 20:23:09,0.0.347
