reviewId,userName,userImage,content,score,thumbsUpCount,reviewCreatedVersion,at,replyContent,repliedAt,appVersion
4abe8248-ddfb-41b7-b0cd-4ee373577eb8,Krystal Brown,https://play-lh.googleusercontent.com/a-/ALV-UjW9QrUFsfG6k0C8ZJmKSm7-Gm2SKKfHl_Ly1YXBXmpS3y5ph46Y,Love this app,5,0,0.0.329,2024-04-28 01:48:32,,,0.0.329
4771f38b-5056-41f6-be0a-8a23ffc352e8,Shane S,https://play-lh.googleusercontent.com/a-/ALV-UjVIuKvnv3rJqZjNs2CSoJu_Hpz--_Rzw4fNCRgbU2vtviv9HxtF,"It's been pretty great until recently. Lately I'm unable to change the true time of a check-in because the app crashes when I try, and there's no way to fix it. Edit: the crashes have been fixed, so I'm bumping it up 5 stars. Great app.",5,3,0.0.331,2024-04-27 19:26:22,,,0.0.331
427947d8-cc5f-4f3c-8797-446e26384225,Angela Jones,https://play-lh.googleusercontent.com/a/ACg8ocKj087knqlHbanJY2kMgfte85yLHNu5rTFdIwxNdAPcQ_pfEg=mo,"This app is so good. It helps me jot down how I am feeling and you don't have to pay for it! Which is so good, usually you have to pay which is bad. You can also see what you have put over the time. You can get lessons! I just wish you could talk to someone about how your feeling because all you really do is write down how you are feeling 😕 not talking about it. To make it better, they could add a robot to talk to. Over all the app is so good. I fully recommend to people with anxiety, adhd+ xxx",4,0,0.0.329,2024-04-27 19:25:22,,,0.0.329
a3951d0d-72d0-4000-b0e6-d8fd38823678,Jhoana Martinez,https://play-lh.googleusercontent.com/a/ACg8ocKSofHv-hh89WJ5a2QeW4jaF5jTUlGcSlJHkbhRIDF2tVhVhQ=mo,"The only comment I have is that PLEASE, I REALLY need a Spanish version I love this app, but having to translate my emotions just adds friction and makes it harder for me to log as frequently as I could",5,0,0.0.329,2024-04-25 03:54:46,,,0.0.329
a86f250b-baba-4353-8af0-55fa13416425,Jaxson Miner,https://play-lh.googleusercontent.com/a-/ALV-UjXmi2eJasJbJCmhpsoVlj4xIpI6IWs8nb-ggDmy_sP9h0f3Z5JsjA,The only mood tracker that keeps me interested the stats are unique and it draws me in. The color scheme is also AMAZING. The system layout with descriptions of the emotions is great to.,5,0,0.0.329,2024-04-24 06:24:03,,,0.0.329
2759a324-a885-4f05-93df-a802254e6a4d,Burgundy Black,https://play-lh.googleusercontent.com/a-/ALV-UjVIIHz20GTs3MHfmzEwuPEQ9VcGnEUnAP5XFHK9Dj9IOL_n1tSS,"This app is UH-MAZING! I have a cocktail of mental and emotional stuff I'm finally working through. The layout here is engaging, fun, and aesthetically pleasing! I like the emotion wheel/ puzzle piece concept. As someone with high functioning autism, I really love the puzzle-esque aspect. And so much is done for you! Which, in my opinion, is something one wants in a mood tracking app. Used Dalyio for over half a decade and I still could not recommend it to the degree I already can with this!",5,27,0.0.329,2024-04-24 02:43:12,,,0.0.329
70b00c91-8f68-43c4-be0f-6938f35b3975,Kai,https://play-lh.googleusercontent.com/a-/ALV-UjXJ0vmwj9Ip53ax9FR3jgEyJHDilcbGZ4T4jpRmbKCyNQIFGMI,"Great app, would recommend to everyone. Easy to use and navigate. Great for understanding my emotions and identifying patterns.",5,0,0.0.329,2024-04-23 12:54:59,,,0.0.329
93e91a2e-e5cd-4956-8acc-57d86375854f,Jadyn Townsend,https://play-lh.googleusercontent.com/a-/ALV-UjWnpsRP4FmjtCsYlzopEkuGIApyMn9Gf6iBnTxwo8Cjubsl_ij8SA,Is there an option to take a picture without saving it in the camera roll? Like kinda similar to snapchat option?,3,0,0.0.329,2024-04-21 16:53:42,,,0.0.329
93811379-3700-43ac-8612-0255a8ad10a6,Vrushali D,https://play-lh.googleusercontent.com/a-/ALV-UjVlNS7U-TvjyIKuUYkXnVdcMO0_JAtTmbLgWf7U_DlfD0haGbug0w,Thank you so much for this generous initiative while others r busy making money on such a humanitarian cause,5,0,0.0.329,2024-04-17 01:52:35,,,0.0.329
dcfaf409-a5eb-48a3-837b-a9a77fed7e27,Dragon- Like-Tendencies,https://play-lh.googleusercontent.com/a-/ALV-UjXuMzFLE7sTEuBkcTvLc8xkFpbhOMQQUljFh2F0VkfwjnCtfA8,"Well designed, free, and absolutely no bs. Its what it says on the tin and is exactly what I wanted and a bit more. The self-analysis with organized data is especially helpful. Sometimes the emotions can be a little constraining, there's no 'other' function, but it allows me to try and figure out for myself the closest equivalent. 10/10, will donate to the project. May even try and see if I can join up on the project side as well, who knows.",5,15,0.0.329,2024-04-17 01:12:20,,,0.0.329
3a266bb8-fbae-435f-a793-cc37bace1dd0,William Maddocks,https://play-lh.googleusercontent.com/a-/ALV-UjVKUXBpFa9YspPw5kN2gpiDqzFqgKk4lY8qdbfcYAEtqrWQiVSC,"Just perfect, the way it guide you to reflect, the analysis, the notifications, everything works smoothly and it looks good too. Everyone could use a little bit of help understanding and communicating how they feel",5,0,0.0.329,2024-04-15 07:26:53,,,0.0.329
4b5f0209-5569-431a-bf5f-3357fc95984f,Quindora Taylor-Pirogov,https://play-lh.googleusercontent.com/a-/ALV-UjWR4nGkubO0GBjVnKoB1lj8eRqeSf4H6iwlDvJkE1etrxpqQ1IOng,Best app I have ever used. 10/10 Loving it,5,0,0.0.329,2024-04-14 05:56:58,,,0.0.329
ffd5daa6-9d01-45a3-9827-9f53c8948eb2,Aster M,https://play-lh.googleusercontent.com/a-/ALV-UjWpxVmZw6s_4ZuYQbR8XWGMzI0Db9QT126TLbPvvdlOBJiTNkkv-g,I love this app for the most part and how you can upload multiple moods per day but I've been experiencing a technical issue. Whenever I try to set a mood to an earlier time of day the app crashes. I frequently forget to upload my mood and this feature would have been very useful if it was working.,3,3,,2024-04-12 01:07:02,,,
29901403-fc20-408c-b900-c7f0b7b99c53,Krystina James,https://play-lh.googleusercontent.com/a-/ALV-UjVEIj8ozg436e7xNRy73N1-ouYtitQzn68nartWCcdi-U2owj-0,My therapist recommended this app and I am absolutely in love with it! Checking in with your mood is so easy and I love that we get the definition of the word (feeling) to help identify the correct one! I would give 10 stars of I could,5,0,0.0.329,2024-04-11 07:36:46,,,0.0.329
f73f8cef-5a09-4a94-bced-a2e1dd938e4e,Nguyễn Thị Kim Ngân,https://play-lh.googleusercontent.com/a-/ALV-UjUk0PvUd7AyC7ojNK3okBvAg3_8cTBA4JX51LLAz-MH03qPWHDf,"I can't believe the app is free. As a psychology student myself, I feel appreciated and grateful for the developer team to create such a necessary app for mental health. The graphics are beautiful, short videos with experts are on point and provide MANY strategies to deal with uncomfortable moods that I haven't known before. Thank you so much!!",5,3,0.0.329,2024-04-11 03:13:03,,,0.0.329
d26d6579-dc98-4093-9c7f-6f708e311cca,Giorgos Spyridis Solachidis,https://play-lh.googleusercontent.com/a-/ALV-UjVLUmk1HpJWNZzbKvz0Zwi8O2NAWObYhOg_xoO0d4QjKDzFWvAxGw,Very useful!,5,0,0.0.329,2024-04-07 23:18:46,,,0.0.329
3e67a656-e2c4-4abc-80b9-b3bb662d665d,Hannah Darnell,https://play-lh.googleusercontent.com/a-/ALV-UjVnakffijU5ipMr6_3yuO_PH8BFX5H2ZRO7FCR1mpDikb237WW5,I really love it. Everything about it.,5,0,0.0.329,2024-04-07 22:44:54,,,0.0.329
758dd5da-6108-43d8-bb9d-a57c4693c4e5,Lucian Cat,https://play-lh.googleusercontent.com/a-/ALV-UjX2Y_YivCQK_vS4CyQuY3Ps7tp9qnf3YoO_WhmGKJ_yejIO7wM,Super easy to use and not overwhelming thank you,5,0,,2024-04-07 21:01:55,,,
5d04a8a7-fe59-4b5a-b843-f16c0a98b496,far cough,https://play-lh.googleusercontent.com/a-/ALV-UjXcOsHZJn0_-N8M_WmvNDZqc82AeJrn_NP430THjklym3qopZE,"Nags for data, makes you sit funny and breathe weird to stress you out. Such joy",1,2,0.0.329,2024-04-06 19:42:19,Thanks for your feedback. We’d like to know the details of the problem you mentioned. Please send the details or screenshot to support@howwefeel.org. We'll pass it along to our development team and see if there is any way we can improve it.,2024-09-11 18:28:14,0.0.329
ee5c9226-5b86-4401-8a68-28c82cb35bbc,Dannyel Morell,https://play-lh.googleusercontent.com/a-/ALV-UjUeSysc2IMwD3XFOKlUnzXgshHGAt3rMOFSb_N1fiq139esXnmZkw,"Love the HWF app! It's a game-changer for personal growth and life coaching. The unique shapes and detailed descriptors help in understanding emotions, enhancing consciousness. As a life coach, I've seen its positive impact firsthand. User-friendly and truly transformative. Kudos to the HWF team!",5,1,0.0.329,2024-04-05 15:44:21,,,0.0.329
ee5f8532-861e-4625-afad-8969cad7f544,Blaine,https://play-lh.googleusercontent.com/a/ACg8ocKNF9IMX43K-tPgGhaducSMhm2YmvwRNXi9u4QZElvONjjctMI=mo,"I won't lie, I very much enjoy this app since I've found it. it's definitely an interesting alternative to Dailyio. however it's missing a major feature that makes it hard to recommend (hence -2 stars): there's no 'Restore.' you guys have the backup feature, which is great. but for a journalling/mood-app, it's kind of imperative to have a way to restore the app from the csv files... you'd likely also get more concerts with such a feature (w/ a guide on structuring data from other apps)",3,12,0.0.329,2024-04-04 17:55:42,,,0.0.329
49bfb404-ad0f-4f78-b911-3f17d310c2ec,Joseph Ciavarella,https://play-lh.googleusercontent.com/a-/ALV-UjXkhbOYi0QRI8zavzqMOX44Z1Cm7EuJDGRAObm1CjIkVJEtEwTKNg,Keeps asking me to set up again .,2,0,,2024-04-03 14:14:01,"Our technical team has solved this problem. Please update your app to the latest version. If you have other problems, please contact us at support@howwefeel.org.",2024-09-11 18:28:23,
277fdd2c-5a8f-4fc4-9975-b0e11d75be31,Marty Fowler,https://play-lh.googleusercontent.com/a/ACg8ocIFjhrAlpc_MeIq49oxFuU4ivOh_yJDcY5l6fth3ES6if2wNA=mo,"This is an excellent app. I didn't realise how much of an impact labelling my emotions would have on my moods and the short strategy videos to help calm my emotions are great. It's rare to get quality help like this for free anywhere today, thanks to the developers and those that have donated.",5,0,0.0.329,2024-04-03 13:02:22,,,0.0.329
81e7a1a6-a1e5-415a-a54f-074d7b548e47,Tay (fluffyluffy),https://play-lh.googleusercontent.com/a-/ALV-UjW-PapBc3mYJ6yIIXsXN5L-yxZbAW8ZeI2Rr_8kyG2PIH5Ggy4,"This is a really great app, I just wish it would let you customize the time of day you get notifications for check ins. I don't like that it considers 4am to be late night. EDIT: Satisfied with the time of day check ins, but now they've changed ""Good/Okay"" to just ""Good"", so now I have no neutral emotion to go to. I don't like that they don't have something that lets me describe a state in which im feeling neither positive or negative",4,15,0.0.329,2024-04-03 13:00:10,,,0.0.329
93037441-3756-4be3-a45b-44bab692c373,Harsh Jadav,https://play-lh.googleusercontent.com/a-/ALV-UjWZ58zlC7j-1QSDCxs4gY-w5P1j0hjVl3Qx7C5atjKPLhl3OqS8,It's best ever app for self discovery and and self improvement. And it's free. It's user interface also esay to use. Best app ever.,5,0,0.0.329,2024-04-03 09:28:52,,,0.0.329
5cc4328c-c1b0-4053-a1b7-2cd2d2ee4492,Adam Page,https://play-lh.googleusercontent.com/a-/ALV-UjX8BfU0lFk097v01V4_RsCnRVVNXqEJo_gAdh-aYjmGUbmsvB5bVA,Please add the option to lock the app,4,1,0.0.329,2024-03-31 13:15:38,,,0.0.329
ab92ac0f-613e-4fe9-9504-6471d30277a3,Calli Estes,https://play-lh.googleusercontent.com/a-/ALV-UjWgscfCGoJsrAbmJtZTSSpqAZud1K0hp6oI09Nln3n9vp5DC9rO,App is great. But it won't let me enter my friends codes at all,4,0,0.0.329,2024-03-30 23:39:40,,,0.0.329
0435a64c-1402-43d9-b537-56d1e48bf4d2,Eli Weierman,https://play-lh.googleusercontent.com/a-/ALV-UjX9-KRaEbwidbkW1nht_fjbeumQXVKsFjgqpoHh8E_bTRDEl0Q,"I've recently found this app and have been using it in conjuction with my therapy. I really appreciate the lack of in app purchases, and they don't bombard me with ads. Just these details make it much more usable. I've learned so much about myself and my habits through the analysis. Tracking feelings regularly has helped with personal regulation as well. There has only been once or twice that a word is not featured that I would've preferred to use. My emotional lexicon is expanding!",5,7,0.0.329,2024-03-30 19:39:26,,,0.0.329
33fd7cca-d202-436a-a828-23f745916235,Harshita Mourya,https://play-lh.googleusercontent.com/a-/ALV-UjV9o9JyTrYlw3PsQQfiDhF8AnkRZ2sS94OGLhH5X7iYi8SCAWU,This app is the best!!! I've never scene such a splendid mood tracker app before. Even if there were feww good apps but still paid. But this one owns my heart. It's magically beautiful and it's free! Thank you so much for making this app n still keeping it free. 💗❤,5,0,0.0.329,2024-03-30 05:22:34,,,0.0.329
d8ebe865-db36-4ed8-92ac-b34ce43c7440,Sherry Hunt,https://play-lh.googleusercontent.com/a/ACg8ocK1k54J4MwkRRWSA64jugX8Jxrrq4SVWoJqmyFWlZalMFEPqg=mo,This app is awesome its already helping me and I haven't even put it into action yet,5,0,0.0.329,2024-03-29 19:44:53,,,0.0.329
53af4e1b-db0b-4f40-a9d4-f2ada1781c0b,Fuzzy Hamsters,https://play-lh.googleusercontent.com/a-/ALV-UjVcTctWVWB2bea3vqlJ8lffi0NgyxzxGoaaEtbFNghQxUxJli2q,"Underrated app! There's a wide range of emotions and I love how it comes with a small description. On an android phone, there may be a bug as I cannot see who reacted to my check-in, although others on an iPhone can see their own. It would also be nice if we could leave a small reply to someone else's check-in other than an emoji reaction.",5,1,0.0.329,2024-03-29 14:38:15,,,0.0.329
bd5dd64a-5464-4a24-9eeb-da831327a087,Rachel,https://play-lh.googleusercontent.com/a-/ALV-UjVjmNjBdHCykjaqHR5YqwFrzVsuccnRKiBV21_ieYlzAODAvcD_,"Liking this app so far. Has the best interface and method of all of the emotion journaling apps I've tried. The only thing I've noticed is that if you add exercise to an feeling it gets added to all the feelings in that day, even before you do the exercise.",4,0,0.0.329,2024-03-27 09:19:31,,,0.0.329
185ff6f4-9f95-4bdd-89ec-c6fb912cdcde,Sandra,https://play-lh.googleusercontent.com/a-/ALV-UjVNoEM91mWhhcRnTO3zQWl5fFTUJ-vyjqc1p0jRPco9cBnN_Tz7sw,"i am very happy with this app overall but in the most recent update the good/okay emotion got changed into just ""good"" i really liked the emotion good/okay because i could just select that one when i was feeling neutral, i think good doesnt describe me feeling neutral as well as the word okay. its a really small change but im quite upset about it",1,8,0.0.329,2024-03-25 21:05:45,,,0.0.329
769bdb74-eae3-45da-8834-b210f3b53d0d,Nyekita,https://play-lh.googleusercontent.com/a-/ALV-UjU2-M0C6z67xp3MuqsMA5IPcIZ8M28xnMdKGBcSEFXf6XzB5iLC0Q,"I like this app not only for its mood tracking, but also for its very useful videos. This all helps me feel better and stop experiencing negative emotions.",5,0,0.0.329,2024-03-25 14:37:18,,,0.0.329
cc674d83-c646-455e-87ec-2b2ffef8e7fb,Grace M,https://play-lh.googleusercontent.com/a/ACg8ocJ8uzJ4oLAYbNM5UGNq0Om8D1HmDDuu2sPU0X0nyQw_fmuT230=mo,"UPDATE: UI changes have fixed this issue so I'm bumping my rating up. The only improvement I would suggest is being able to add more than two emotions at once, but I know that might complicate things, especially in data from people opted in to the study. (3 stars): ""Really love the concept and this is the exact type of mood tracker that I need! It would be a 5 star app for me if one issue was addressed: After entering note text, the save button disappears and I'm not able to save my entry...""",5,19,0.0.329,2024-03-25 13:30:36,,,0.0.329
85a7b3cf-6d28-4800-8e13-90528b06d455,Osama I,https://play-lh.googleusercontent.com/a/ACg8ocLuQyvUPE6jApZBXMMEyvgVlyfNEd_Bn-y_QHo9lsLTGebj02PQ=mo,This is a must for all of us so we can balance out our emotional and logical brains and make them work hand-in-hand to be able to achieve true content life.,5,0,0.0.329,2024-03-25 02:49:15,,,0.0.329
07ee42a2-e64f-47bf-bd46-ebb8c010d4f2,Jardena K.,https://play-lh.googleusercontent.com/a-/ALV-UjVW-NcF2Vuqb8YiLqrO2z_HFKhBmggc8I57XqAoQJPeXGM9i4zD,"to support: last few days dumps when I try to choose another time. really cool, helps be more contious with your emotions.",5,0,0.0.329,2024-03-23 19:21:04,,,0.0.329
5a04d7e2-e1f4-45a7-9df7-d54a77a01222,Nichole Coito (Nikkie),https://play-lh.googleusercontent.com/a-/ALV-UjW8u9RQI8ci_R_80XBIE6K0PJNYETo7rboOzRTZikubp7zCj_zfqA,Videos don't play so unless app,1,1,0.0.324,2024-03-23 14:23:18,"Our technical team has solved this problem. Please update your app to the latest version. If you have other problems, please contact us at support@howwefeel.org.",2024-09-11 18:28:55,0.0.324
5d3c4087-fc4b-4da4-baf5-9ee31175dc36,Erik S.,https://play-lh.googleusercontent.com/a-/ALV-UjUW7YFtY7R5xuVh2tKK6f59UN9hV5H2l3Ba8N-l1yDLN3JBdi3I1A,"Phenomenal, non-invasive app for tracking emotions, causes, and trends. You have full access to and control of your data which you can export later if desired into a nice excel / notepad csv file. App also has incredible dashboards that help you identify how your emotional quadrants line up with days of the week, activity tags, and levels of sleep. Others are also available. Unequivocally recommended.",5,2,0.0.324,2024-03-22 22:28:52,,,0.0.324
062d6f87-45c8-4988-ac8c-d01db8aa7902,Ditra Comer,https://play-lh.googleusercontent.com/a/ACg8ocIakBiyrTZZCcwnN2Pzgr8__aF7B31iYrAJ-D08lER9SWTR-Ow=mo,Love this app it's like therapy to me I can learn about my feelings and watch helpful videos.,5,0,0.0.329,2024-03-22 08:59:56,,,0.0.329
a54c561f-c71c-4891-ad4a-b3d2b8827074,Alex Banx,https://play-lh.googleusercontent.com/a-/ALV-UjW-h1WfYmSmz-7OqPERpFFfVPcJY4pIh0l1-p5PmmAIQmS-9Q7U,"free. no ads. no super gimmicky self-help book type degradation, so far. I've watched only 3 videos. they were nice. I'm taking one star off bcuz it verges on the degradation assuming everyone has a limited vocabulary, not knowing what words vs not being able to tell others the words we're feeling isn't the same thing. I understand most people probably do need help with basic words, but the language used needs to be more inclusive to those who do have the words including those not listed.",4,2,0.0.324,2024-03-21 21:31:43,,,0.0.324
86d79743-e4a0-4167-82cb-5b765410a4d7,1 2,https://play-lh.googleusercontent.com/a/ACg8ocITKACfJybOacn58z_w-ZYFbiycqoZkAKURGl6FZqICPU6cBw8=mo,This is one of the best game-changing apps for me. I went from not knowing what I was feeling and experiencing a handful of confusing feelings to being able to separately label each and every feeling. This itself is a huge step for me. The only thing I wished this app did was ask like a simple question or add a reminder to breathe and feel your feelings before just picking one that sounds more accurate.,5,10,0.0.329,2024-03-21 05:15:40,,,0.0.329
085b8e24-d52b-4b4f-b10e-141898cf9d0f,River Jacobs,https://play-lh.googleusercontent.com/a/ACg8ocL8TKf0nL2p8LBnobWubwYSWIh17bM2qNQN9xpNwnPL_K8Gy0Lf=mo,"Cannot stress this enough: is changing my life! This app literally is rewiring my brain, and it is showing me tangible proof about my moods, excercize habits, and strengths as well as what I can work on. You get the chance to even add activities in?! It's so neat!! This means that you can log what works and what doesn't, and you can also revisit your logs to understand yourself more and see trends! Loving it. :)) videos also help!",5,6,0.0.329,2024-03-20 16:21:15,,,0.0.329
1406ab1d-7c52-4f3f-bc0a-61d3eea93015,Elise O.,https://play-lh.googleusercontent.com/a-/ALV-UjVcESpOZ460LUV17bZimUsMWRLkeZGwFeAOXxvtzf6LxdXlS0nK,"Only been using this for two days and it's been great so far. I'd appreciate if I can password/fingerprint lock the app, though. Because it is still a journal. And I'd like to keep my journal private.",5,0,0.0.324,2024-03-19 09:15:13,,,0.0.324
cd64bfc5-9db4-4565-b0c1-650a4e411cdf,Alex Wong,https://play-lh.googleusercontent.com/a-/ALV-UjWNY5PDh7VSE_yCusQVEzTYqk2KoS_Ian8OlkxBA9i8p38r3WJA,"I LOVE how easy it is to track, find and find strategies to help me everyday! The statistics help me find patterns in my emotions. Seriously I could go on for a WHILE.",5,0,0.0.324,2024-03-17 07:04:27,,,0.0.324
bc78d1e0-c68d-42ed-a9f7-6f67d9ab995d,"Seth, Mr. Good Vibes",https://play-lh.googleusercontent.com/a-/ALV-UjVGk11DR4r_KOiNGMeMRTbWs2xyBIuXLgG2i0F9klj8cVT8lk3uOg,"Fantastic app, majorly improved my life",5,0,0.0.324,2024-03-15 15:54:02,,,0.0.324
e2af304b-7823-4e4f-81c8-e628f734cba8,Liv,https://play-lh.googleusercontent.com/a/ACg8ocLQbG7hkOYbN8czXQiX0ewq1bS5kJKXdqfilWTBh4t65w5dyQ=mo,An awesome app I'm using to understand my feelings and regulate accordingly during this difficult time of burnout. Thank you!,5,0,,2024-03-15 07:47:01,,,
298909ef-5807-4990-a037-232f78991606,Radek Pilich,https://play-lh.googleusercontent.com/a-/ALV-UjXZJRJ-CJjo4IFxe-Gen5pezmdQUy8qtoK4rop5QcvDDaONeg0l,"Awesome, much better than similar apps I've tried previously. The 2D organization of emotions is quite a revelation! One issue to be addressed - please consider moving the descriptions of the emotions to the top of the screen, so that they are not covered by the hand / finger of the user when dragging the finger through the grid.",5,2,0.0.324,2024-03-14 12:58:21,,,0.0.324
58d133d4-239b-4642-b4be-339edbc15f82,Chay Raines,https://play-lh.googleusercontent.com/a-/ALV-UjXw2k-JoJznBiNDQQ-zGVYYDIR7u5xKJJBGt4SIWlP0_nXtV-ZC,"Update: Fixed the error in my 1st review, so updating my stars to 5! Can't make any entries into the app anymore. Error message: ""HWF isn't optimized for the latest version of Android. Screen touches may be delayed or not recognized. Also can’t login across devices to make entries under a single account. Would have to start all over again. Very disappointed as I was loving this app and recommending it to friends/family. Willing to change rating & review if HWF can fix the keyboard glitch.",5,1,0.0.324,2024-03-14 12:55:59,,,0.0.324
9a1767f2-540b-4f3e-8f80-b3cf4cbc480b,Kristy Ross,https://play-lh.googleusercontent.com/a/ACg8ocJLxd318WY3TF1DqvEEzvxBR5u1Uami85vrPXIuIt_TEL-B_Q=mo,The best mental health app around! I don't usually like the apps for monitoring feelings and thoughts etc as I feel they are too limited and prescriptive but this guides you in a structured way without it feelings limiting. Great work!!,5,0,0.0.324,2024-03-13 22:23:13,,,0.0.324
66cc72fe-34ed-43aa-85b4-34de60b0d741,Johnny Tirado,https://play-lh.googleusercontent.com/a-/ALV-UjUyOfMwdz96mfS_n_HFhO6qGIRW35RvsdHyMvjy8zhzIuOJhwdT,"I'm an AuDHDer with Alexithymia and this app is useful to me. The reminders help me to check in and the check-in process is super easy, even when I'm feeling awful. Analytics are great to review, there is good self-help content and they actually have decent privacy policies in place, asking for demographic information instead of just collecting it. The emotions come with good descriptors so I understand what I'm choosing. Thank you!",5,2,0.0.324,2024-03-12 16:19:27,,,0.0.324
0c7c8507-ff4a-41a3-ac44-ad1e16af27f3,Daniélle Krige,https://play-lh.googleusercontent.com/a-/ALV-UjVNTv_a3WaabK7aJYIPkiWVOXTStXdzU7q4COCW0FKgBdk4KlxaHA,Really amazing app to help with emotional regulation!,5,0,0.0.324,2024-03-12 07:22:22,,,0.0.324
4345e7cb-e352-4f22-982f-7f6d91e6cc42,JHS,https://play-lh.googleusercontent.com/a-/ALV-UjWXpmNxC4TLcQAziA6BM0fCJgltuqS-H0aZ0MIbLRBcwN4jwxG3,"Absolutely amazing, helps alot",5,0,0.0.324,2024-03-10 22:23:59,,,0.0.324
4366833a-204a-4a50-b188-551240f2c2ec,Oleg Kalenbet,https://play-lh.googleusercontent.com/a-/ALV-UjUyGcDM5FPs3F-hQU5PR2S4TrUIW9ykd_6M3DeeDU_bc0VG9c1L,Smart and simple way to understand yourself to express recognize emotions. Let's to collect statistics. Video support particular type of emotion and expand with time. Thank you!,5,0,0.0.324,2024-03-10 13:55:59,,,0.0.324
9cdbcbb6-edb4-41fe-8f68-8a4c1b8df68c,Daniel Linhart,https://play-lh.googleusercontent.com/a-/ALV-UjVtXt-5Zhne7-SD7Y4XC_kl9ciNWzn3NNAFVMETda1QbQJb5oi82g,Absolutely amazing app to track your emotions and learn all about them and therefore about yourself. Thank you 🙏,5,0,0.0.324,2024-03-10 05:00:15,,,0.0.324
abcd1b7e-095a-488a-82d5-3eada3efdb57,Bonnie Cannon,https://play-lh.googleusercontent.com/a/ACg8ocIspabzeddildVNJFzn7np52G_gMgDnWnXjmrbGNd0s3_Caghhd=mo,"Such a cool app, and amazing that it's free! Everyone should try this!",5,0,0.0.324,2024-03-08 03:42:38,,,0.0.324
136f962c-25d9-415a-affe-5fc035011254,Amanda Adams,https://play-lh.googleusercontent.com/a-/ALV-UjXauW5duxOqojk4eLS22E-lalPxJrfASyi2UVms1j2HYi9O5numSw,Lame. Only let's you select 1 emotion. Who only feels one emotion at a time? Definitely not me. Uninstalled as soon as I realized it was limited to just 1 emotion at a time.,1,3,0.0.324,2024-03-05 19:42:10,"Hi, you can select two emotions with each check-in. Please contact us at support@howwefeel.org if you have any questions on how to do so.",2024-09-11 18:29:26,0.0.324
344f0812-80a7-4e80-bc11-fb4e1d8b2b64,Dorothy Ann Goh,https://play-lh.googleusercontent.com/a-/ALV-UjWxzVQ6E5EpMMaiKT-NMnejJdZSp5W3VpspvWpI2noEhpRFVQZ-6Q,"as an alexithymic, i find this app really helpful in identifying what im feeling",5,0,0.0.324,2024-03-05 12:50:54,,,0.0.324
ea4fc223-addc-4c77-a35b-edda98c400eb,Paige,https://play-lh.googleusercontent.com/a/ACg8ocLxZL-Xa4CIpA7muH54CnFKe-4ljkcjG-vTvmZ5LWVtSO2WnfV4=mo,"App is great. I especially love the ""learn"" section. But I wish I could see the individual daily entries somewhere with all the details, the emotion and the note and sleep details etc. There's no way to look at them again after you enter them. You can see trends for the week/month, why can't you view by day on that same page and see the actual entries?",4,15,0.0.324,2024-03-02 18:24:20,,,0.0.324
