reviewId,userName,userImage,content,score,thumbsUpCount,reviewCreatedVersion,at,replyContent,repliedAt,appVersion
1c3399cc-8bec-4fdc-9157-3150055495bc,Jean McCormack,https://play-lh.googleusercontent.com/a-/ALV-UjXeRqFhmmS0UEXjEderZskCrX85_WLBkd7X7CfU_VKG2BpEC97Rww,Just brilliant,5,0,0.0.342,2024-09-17 05:16:19,We appreciate the review!,2024-09-23 22:44:50,0.0.342
3c112c79-b92a-4995-9d4d-da3bdca4acf4,Emilie Schorr,https://play-lh.googleusercontent.com/a-/ALV-UjUejzXdxg3tH6efDi7dKepJNEbbCPxHdzzLMQkwFDyvcEobXEY,"I love the simplicity and customizable tools. It's like the mood-tracking part of Sanvello, but better. Lots better. I don't feel judged by my emotions, and it helps me remember to use the tools I learned in therapy. Would absolutely recommend to anyone who needs more mindfulness in their life.",5,3,0.0.342,2024-09-16 22:01:10,Thank you so much for your review!,2024-09-23 22:46:25,0.0.342
a771c44e-98ce-43d6-80de-38b17b203e6d,Aziz B,https://play-lh.googleusercontent.com/a-/ALV-UjVNMg2ELaGhIEVhcxxvqcH_zBP-9mn2SWDo-xzPhOFWy7c0waKF,What a wealth of wisdom. Already impacting my life! And it's free. Listen to huberman lab episode with Dr Marc Brackett to learn about how this app and how it can change you and people around you.,5,1,0.0.342,2024-09-16 17:37:45,Thank you for taking the time to rate and review How We Feel!,2024-09-23 22:46:57,0.0.342
48ad02a4-88f6-4e91-8eaf-1587d82763fb,Lisa Stamps,https://play-lh.googleusercontent.com/a-/ALV-UjUcMn_m-IidW7oor7OgqwON8JRm3TvLxqrhAOV4LDClK2GdqvHdxg,"I love learning how I'm actually feeling; I grew up with 'sad,' 'mad,' and 'glad.' My therapist asked me to try it so I can learn to name my feelings more accurately. It's working! I'm actually making conscious, aware decisions. It sure beats the bla.",5,0,0.0.342,2024-09-16 15:18:58,Thank you so much for your review!,2024-09-23 22:47:16,0.0.342
4090bbb2-fec7-40eb-9bc1-7f04bd37ed47,Márek Líška,https://play-lh.googleusercontent.com/a-/ALV-UjU7-YFosnQVeKiX_q_6OvFvOy09FAEYJHLz9ElicHF0gJlDWKbZPQ,Everything I needed and a bit more.,5,0,0.0.342,2024-09-15 19:50:23,"We are pleased that you enjoyed the app. If there is anything we can do to improve the app, just let us know at support@howwefeel.org. Have a wonderful day!",2024-09-23 22:48:06,0.0.342
9baa5ce6-c679-4bc9-8d36-16352ed00425,Isaac,https://play-lh.googleusercontent.com/a/ACg8ocKXCTEiiMfVqVAdLHNeSN1eJRBSUQ880fiatez3DXHqBtuTcg=mo,Soooo hoid,5,0,0.0.340,2024-09-15 16:34:39,Thank you for taking the time to rate and review the app!,2024-09-23 22:48:25,0.0.340
015ef86b-4fa9-4b13-9035-b50fee18b512,Vel,https://play-lh.googleusercontent.com/a/ACg8ocJESaETHdbu1dZDoqjT3-4yZ34jbJdrtEOTVNd7N5NqlyK4lQ=mo,"Professional, intelligently written, mature. Thank you.",5,0,0.0.342,2024-09-14 01:18:41,Thank you for the review!,2024-09-23 22:50:14,0.0.342
37fe7495-3819-4019-a79e-e0fe616b95bf,Edmond,https://play-lh.googleusercontent.com/a-/ALV-UjWnuZtQohRD6ETN-mwmIGFSOWCe4MT6gQIMrVQ85F09qvBrGZXO,It just deserves 5 stars 👍,5,0,,2024-09-13 22:19:43,Thanks for taking out time to rate How We Feel. It encourages us to keep building and delivering a great app!,2024-09-23 22:51:08,
b095da55-3df9-466a-aa78-d36159def6d1,Miguel Rivas Perez,https://play-lh.googleusercontent.com/a/ACg8ocI5UFE6z6kWxr1npB_QCSeahqtzz6EzG751toh637IFz_iq8OxS=mo,This application is not only beautiful; it is powerful. I appreciate the reminders to check in with myself and keep a record of my emotions. The intuitive interface make it a genuine pleasure to use. I use their tools daily!,5,1,0.0.342,2024-09-13 18:13:43,Thank you so much for your review!,2024-09-23 22:51:27,0.0.342
f47ee2f5-e752-4b29-a3db-3f9be425d312,Nial,https://play-lh.googleusercontent.com/a-/ALV-UjU_V5QgDGSmr4s3UXD1s6hL81U_ei32AUmwQwaTE2A0RD9T9blF,I wish we could say our day end later than midnight but exept that its a really good app!,4,0,0.0.342,2024-09-12 22:40:07,Thank you for the feedback! We will consider this feature.,2024-09-23 22:52:29,0.0.342
19f0efe9-3590-424e-bf95-1a85b7ade594,Chelsea Campbell,https://play-lh.googleusercontent.com/a-/ALV-UjWQHb5gBGnIv-FpRLRAIEfHJEtfVPeRdbo1j8UEOIen4veZ-Aqn,"Updated review: The developers of this app provide support and are very helpful. when i encountered my issue in May. They reached out and kept me in the loop on the app fix. Ever since that update, I haved enjoyed this app. It is easy to use and I like that I can have more than one emotion in my update, and I like having the ability to share my statuses. keep up the brillant work! Original review: This has the making of a great app. I was invited to join in order to support a friend's menta",5,11,0.0.342,2024-09-11 18:45:58,"Oh no! We sincerely apologize for the troubles you've had with the app. We'd be happy to take a look into this for you, please contact us at support@howwefeel.org. Thank you.",2024-09-11 18:27:12,0.0.342
0a53704d-7b86-4916-b59a-240c1b3c50d1,Robin Gibson,https://play-lh.googleusercontent.com/a-/ALV-UjUD2RnIooHU0Gfts6AkgJkLoGco8mMn8S10H_G2gp69KupRfuu1,"Brilliant app. As someone with suspected ADHD and Autism, its very hard for me to describe how I'm feeling. This app lays emotions out beautifully. However, I am having a bit of trouble with the ""Grateful Moments"" best self tool. whenever I select a photo, it crashes. other than that, I highly recommend!!",4,21,0.0.342,2024-09-11 18:41:36,,,0.0.342
b5dea5a9-7291-48a1-911a-0eaad1b1a9a8,Hsu Myat Hnin,https://play-lh.googleusercontent.com/a-/ALV-UjWo109qhXxA8abLFtK3sGE2oUsgvPkQUs2WwZXWARi-6zyAAeHurg,This is such a novel apk for tracking emotions with abundance of choice for different emotions. Great visual UI and smooth experience with Videos about emotions and activities to control or understand our own emotions.,5,0,0.0.342,2024-09-11 16:53:31,Thank you for your encouraging words!,2024-09-11 17:54:27,0.0.342
d0c9af8d-16f3-4123-bc8c-29287b3be6aa,Stella Star _/,https://play-lh.googleusercontent.com/a-/ALV-UjWebdFPZbkuT5G8kDKD5oneQBvjoxotq_pZrG605kBDXBWCYi0,"Absolutely amazing! And completely free. If everyone used this app, the world would be a better place.",5,0,0.0.342,2024-09-11 04:07:45,Thank you so much for your review!,2024-09-11 17:54:42,0.0.342
d22c80d3-3996-4e8c-841c-e3eb1c6a7263,Dragos Nica (Jeje),https://play-lh.googleusercontent.com/a-/ALV-UjVOosZdmT4SFjQiRUb_Mv5MxDEQ-Wh3jgP2tZFFq_nxSZIATHpm,Best mood tracker there could be. I bow before you,5,0,0.0.342,2024-09-10 17:55:05,Thank you for downloading our app and providing a review!,2024-09-11 17:57:37,0.0.342
6dd0a564-25df-4c5c-9057-e02a709afd58,mario do bairro,https://play-lh.googleusercontent.com/a-/ALV-UjUFvxq5bHrA-h3GuvcJa0ZFLKhUdtTxAHulYSzTsbMcDdzfLx1Y,é melhor aplicativo sem dúvida nesse tema,5,0,0.0.342,2024-09-10 09:42:41,Thank you for the encouraging words!,2024-09-11 17:57:51,0.0.342
88b369cc-7b1f-4332-950a-a2998f0558bb,Michelle Strasser,https://play-lh.googleusercontent.com/a-/ALV-UjWZL-W0oITZDIFRhMeHESe76KtXPLqZiaNdxlRoNgMOJ5oIKZprkw,This is a great app for sharing your feelings with those closest to you (or keeping them private); for learning how to name your Emotions; and for learning some different techniques.,5,0,0.0.342,2024-09-09 08:24:06,Thank you so much for your review!,2024-09-11 17:58:08,0.0.342
29471f25-c2a8-4021-9abc-74595dadc1cc,Kalpak Tapas,https://play-lh.googleusercontent.com/a-/ALV-UjW_wZhgyrpVudV8Fa-WIaxvHD4zmvRglgiAmELA2cjbebvT6cU,Nice and informative mindfulness app.,5,0,0.0.342,2024-09-09 03:18:48,"Thanks for your review! Please recommend our app to your friends, and don’t hesitate to shoot us a note at support@howwefeel.org if you have any questions.",2024-09-11 17:58:30,0.0.342
f42fba40-8402-4195-aa75-ec52cddf7c0d,Irish,https://play-lh.googleusercontent.com/a/ACg8ocI3eT854c6FYB-g95Gmq1NbcYHc6u8zmI7FNV4lZWH4Jaz9QfRX=mo,Great app! clean interface and unique approach to a very real problems.,5,0,0.0.342,2024-09-06 14:57:20,"Thank you for the encouraging words! Please recommend our app to your friends, and don’t hesitate to shoot us a note at support@howwefeel.org if you have any questions.",2024-09-11 17:59:33,0.0.342
aa2ab3d4-d8d2-4af3-a2e8-801de02a1fb3,Bret J. Swain,https://play-lh.googleusercontent.com/a-/ALV-UjW_Dt1EOcuiJu_drBoAQ-7fQ8bZ6IS6shEkiiAsstXvDHHOWjxH5A,"Plenty of lessons, and descriptions about your emotions. This is great self help!",5,0,0.0.342,2024-09-06 00:41:04,"Thank you for the encouraging words! Please recommend our app to your friends, and don’t hesitate to shoot us a note at support@howwefeel.org if you have any questions.",2024-09-11 17:59:44,0.0.342
fdeaff23-9032-439b-9d95-b822bec16378,blues vance,https://play-lh.googleusercontent.com/a-/ALV-UjWxnDTTnRlBXG7HoxqUV5i64z9YhD5wvqciYagNSr6FDHu3q5I,THIS APP IS AMAZING. No intrusive ads. Most apps these days are 80% paid and locked content. The exercises are amazing. And the graphics are amazing as well. Can't complain so far.,5,0,,2024-09-04 23:50:47,"Thank you for the encouraging words! Please recommend our app to your friends, and don’t hesitate to shoot us a note at support@howwefeel.org if you have any questions.",2024-09-11 17:59:56,
8b8009b2-e60c-4c39-8ce2-40f303ee9db3,Roshni Sharma,https://play-lh.googleusercontent.com/a/ACg8ocKtESxadPfceFQCxaWbYudJ015dLHy1Wt18N1hnshYdotd7AvWL=mo,"Super useful, quick and easy",5,0,0.0.342,2024-09-04 21:30:26,"Thank you for the encouraging words! Please recommend our app to your friends, and don’t hesitate to shoot us a note at support@howwefeel.org if you have any questions.",2024-09-11 18:00:03,0.0.342
06522c9a-1536-4c42-9f63-9c4dfff4abd9,Laura McWhae,https://play-lh.googleusercontent.com/a/ACg8ocLwEQKs0bhMvkw24C_Llmy_BEfQAQHLICpB4EnuuMPY6a5uvDE=mo,"My favourite mood monitoring app I tried. Love the simplicity ease and cool way of choosing the emotion you are feeling. Completely for free with excellent 3 exercises and topics thrown in! I am finding this app really helpful, thankyou!",5,0,0.0.342,2024-09-04 10:05:22,"Thank you for the encouraging words! Please recommend our app to your friends, and don’t hesitate to shoot us a note at support@howwefeel.org if you have any questions.",2024-09-11 18:00:27,0.0.342
809bbd88-d384-4f3b-a925-c12778c3272d,Tia Alexander,https://play-lh.googleusercontent.com/a/ACg8ocIoAinRYkQRdv9ev7WKs3UcOQl8WZBgu67fv6_Tr7XSzJLISA=mo,"Brilliant! This app is everything you want and need. Simple, effective, helpful. Thankyou!!!",5,0,0.0.342,2024-09-03 13:32:11,"Thank you for the encouraging words! Please recommend our app to your friends, and don’t hesitate to shoot us a note at support@howwefeel.org if you have any questions.",2024-09-11 18:00:38,0.0.342
499fb5e7-12b0-4f26-9b3b-e626fb177a7b,Bürgus Capra,https://play-lh.googleusercontent.com/a-/ALV-UjWqKQDOcQpXO9_A0tHaBGbhCgk6Ri33qP_tj1nXzY1LmlKcbTM4LA,"The UI is one of the most pleasing things I've ever seen on Android, ever. Really good mood tracker, clearly made with love. I just wish there was a share button on mood history so I could send it to my therapist!",5,1,0.0.342,2024-09-03 10:42:56,Thank you for your feedback! We are working on such a feature.,2024-09-11 18:01:03,0.0.342
c8434c44-2696-4181-acea-1d3d4c97e3aa,Mars Rowan Morgan,https://play-lh.googleusercontent.com/a/ACg8ocLhMf8OuprTgI6y9LhPVGRM7nNLJLHHpz74GtjU-J6kjBlxy6w=mo,"Fantastic way to express, acknowledge, and share emotions",5,0,0.0.342,2024-09-03 04:52:53,"Thank you for the encouraging words! Please recommend our app to your friends, and don’t hesitate to shoot us a note at support@howwefeel.org if you have any questions.",2024-09-11 18:01:10,0.0.342
21b7132c-8d1c-49e9-8ae1-b11a9d78fd58,Filip Pop,https://play-lh.googleusercontent.com/a/ACg8ocLB5p98gLgip9pdZG8rQgTpy21SuLqz1vYHjUDWfzJShGSPDQ=mo,One of the best apps ever,5,0,0.0.342,2024-09-03 03:05:45,"Thank you for the encouraging words! Please recommend our app to your friends, and don’t hesitate to shoot us a note at support@howwefeel.org if you have any questions.",2024-09-11 18:01:20,0.0.342
f48fda5e-1e30-4dc3-ac37-af0a17fae27a,Diana Maraqa,https://play-lh.googleusercontent.com/a/ACg8ocJaONaSiT7b7B5dIf7F4LmeDhBB6fdLigDibCznRTjcYu-q8w=mo,"Amazing app. I think what would really make this app flawless is adding the ability to add notes, kind of like diary entries. I think it'd furthe help with reflecting.",5,0,0.0.342,2024-09-02 10:19:58,Thank you for the encouraging words! You can add journal entries to each check-in. Please shoot us a note at support@howwefeel.org if you have any questions.,2024-09-11 18:03:23,0.0.342
9cd5a3ff-3c97-4673-b52c-302277cdf997,Lemonade,https://play-lh.googleusercontent.com/a-/ALV-UjU6cKBPqCx6yhQfAQ3vMwcG_j7XuxPAottL0s8-ZcjgHlQrB62E,An overall Good app! It lets me freely Let out my emotions in a single tap ♥️ after the bug fixes it's going great,5,0,0.0.342,2024-09-01 05:02:46,"Thank you for taking the time to rate and review the app. The breathing exercises will be fixed in version 0.0.340 on the Play Store, which should be available later this week.",2024-08-13 00:00:15,0.0.342
f0a4cf3a-53b6-48e6-8273-0dc0168d2b5f,Kajsa Sexton,https://play-lh.googleusercontent.com/a-/ALV-UjXNXG9uzZHxAzTWMlojlc8y4EGeeUksLnL4OxNoONfnR8b4ELfP5g,"Free, science-based, easy to use, and with a ton of resources.",5,0,0.0.342,2024-08-31 18:03:30,"Thank you for the encouraging words! Please recommend our app to your friends, and don’t hesitate to shoot us a note at support@howwefeel.org if you have any questions.",2024-09-11 18:08:59,0.0.342
6baf4264-058b-4c24-8203-b80e279bf7c5,Aida Elmahdi (IEatLeeks),https://play-lh.googleusercontent.com/a-/ALV-UjWxapJU1gpZ9oUqF-i3oECPUsyKef2967hmFbyRGLP_w3D_9JGB,So unique!. I'm saying this because the other ones have too little emotions.,5,4,0.0.342,2024-08-31 12:45:16,"Thank you for the encouraging words! Please recommend our app to your friends, and don’t hesitate to shoot us a note at support@howwefeel.org if you have any questions.",2024-09-11 18:09:08,0.0.342
98af243e-8366-40fe-97c4-3b46e93526fb,Michael Shaft,https://play-lh.googleusercontent.com/a-/ALV-UjXqmPXegrhjoa80TM28dtcywNgyITx9-uOIowuANzUNEb2P932o,This has been an invaluable tool to help me identify and speak about my emotions or feelings.,5,0,0.0.342,2024-08-31 01:06:52,"Thank you for the encouraging words! Please recommend our app to your friends, and don’t hesitate to shoot us a note at support@howwefeel.org if you have any questions.",2024-09-11 18:09:15,0.0.342
640d2297-2347-456f-80c0-7a01f691e8c1,Tienie de Coning,https://play-lh.googleusercontent.com/a-/ALV-UjWEFVJ_aDxwTXoW45i2vJF7yaBSqmhBWkQgRPzNVsa_4MuGLTD8,An awesome resource,5,0,0.0.342,2024-08-30 19:19:34,"Thank you for the encouraging words! Please recommend our app to your friends, and don’t hesitate to shoot us a note at support@howwefeel.org if you have any questions.",2024-09-11 18:09:20,0.0.342
01ff5e37-f108-41ad-8983-73cf8498d7dd,Mary Decker,https://play-lh.googleusercontent.com/a-/ALV-UjWyJ0WtWHGJb1frHmItCb427OfrX6wF8wbM9RY8bsk48p_mSPoN8w,"I really love the tools in this app! They are really a great help and easy to return to, again and again! I recommend this app to everyone!",5,0,0.0.342,2024-08-30 17:30:54,"Thank you for the encouraging words! We are releasing new tools in the next release. Please recommend our app to your friends, and don’t hesitate to shoot us a note at support@howwefeel.org if you have any questions.",2024-09-11 18:09:38,0.0.342
de05e67b-0101-4c8d-99bd-737d4ff095ba,Snoogles,https://play-lh.googleusercontent.com/a-/ALV-UjU5VnsmV3EbP8hMKSVDofDgYFjciq3b-CCE9XIck2JFzCUYxdgd,"I only recently got this app and it already helps me notice and label my emotions so I can react accordingly and use coping mechanisms before they get out of hand. I have always struggled with naming and regulating my emotions, being both autistic and adhd, and this helps me to take a second and understand myself. I feel this will be helpful to bring up with my therapist and psychiatrist to better understand patterns and recognize ways I can cope.",5,0,,2024-08-30 15:04:48,"Thank you for the encouraging words! Please recommend our app to your friends, and don’t hesitate to shoot us a note at support@howwefeel.org if you have any questions.",2024-09-11 18:09:51,
5aa26e65-ba7e-45fd-b560-e8fffdc0c3a4,haris,https://play-lh.googleusercontent.com/a-/ALV-UjV-lxAZFr6Bi00nMZWIBbBBalCSdl-tTEirQTmjoE_UIsJDL0Wqow,"Great app, beautiful Ui, smooth as butter i love it !",5,0,0.0.342,2024-08-30 14:14:32,"Thank you for the encouraging words! Please recommend our app to your friends, and don’t hesitate to shoot us a note at support@howwefeel.org if you have any questions.",2024-09-11 18:09:58,0.0.342
b06efc5d-c0bc-4ab2-adbb-bc72d2bd57bc,Varun Tyagi,https://play-lh.googleusercontent.com/a-/ALV-UjWnvBGPcvGg9VRGEYjA3Pymu5Sc70naF94gwsSOEM-R1qOV9jQ6gQ,Super helpful. Very easy to use even for people with ADHD mind. Very good short simple interface. Important things tools. Good way to Journaling emotions,5,1,0.0.342,2024-08-29 23:32:17,"Thank you for the encouraging words! Please recommend our app to your friends, and don’t hesitate to shoot us a note at support@howwefeel.org if you have any questions.",2024-09-11 18:11:57,0.0.342
fcbf2931-61d3-458e-9401-7707209ccbb7,Andi Valentin Boltasu,https://play-lh.googleusercontent.com/a-/ALV-UjXs1oUwAWa0xLkFHe4vln-KtvFepf29_eFGhtwTZ05TzidGB8Og8A,"It's a great app, teaching us all this new vocabulary which ultimately influences our life in a better way. One feature that would make me give it 5 stars would be if the app would be able to add the sleep time, exercise time and weather automatically, from fitness apps like Google Fit, Fitbeat, Samsung Health, etc, because adding it manually is pretty frustrating. Thank you ! Edit: Just like you promised, you added the new features, which make the app even more amazing. You are awesome !",5,8,0.0.342,2024-08-29 06:41:50,"Hello, we are working on an integration with Android Health Connect. This feature should be available in a few weeks. Thank you for taking the time to provide feedback about the app.",2024-08-13 00:17:27,0.0.342
21784bd4-8519-43f1-85e1-82b80290651d,Yutzi,https://play-lh.googleusercontent.com/a-/ALV-UjUeaaKNHtIfWsMt9bOM_mjGEIbA1fGAG3hByzyfFcYrGAYcIIk0,Keeping track of my mood is nice,5,0,0.0.342,2024-08-29 03:54:40,"Thank you for the encouraging words! Please recommend our app to your friends, and don’t hesitate to shoot us a note at support@howwefeel.org if you have any questions.",2024-09-11 18:13:34,0.0.342
4ccee8d2-12eb-4990-849a-94faf92b0436,Maeve,https://play-lh.googleusercontent.com/a-/ALV-UjXOVr8_68mZzCzmnIk8ZUKAC0OdHUWfejFVZfHAcOf3pG626n0SMA,Best designed mood / emotion app I have ever tried. Really promising.,5,0,0.0.335,2024-08-28 23:54:36,"Thank you for the encouraging words! Please recommend our app to your friends, and don’t hesitate to shoot us a note at support@howwefeel.org if you have any questions.",2024-09-11 18:13:42,0.0.335
dfce11e6-a32d-453e-a880-2158aed143f1,Grace,https://play-lh.googleusercontent.com/a-/ALV-UjUGSjrPMY2NoUOaeWAEdrmASOFoQJ1c7jqu_wkqnWLX_9eUG7vR,I'm loving my experience with it so far. I'm sure that other users would be looking for more ways for further engagement and learning. Looking forward to see how more this app would help.,4,0,0.0.342,2024-08-28 20:03:21,"Thank you for the encouraging words! Please recommend our app to your friends, and don’t hesitate to shoot us a note at support@howwefeel.org if you have any questions.",2024-09-11 18:13:58,0.0.342
057b05d0-bc9e-4090-a2ed-002b4089ef79,Hi,https://play-lh.googleusercontent.com/a/ACg8ocKg27hugxC7G8ziw-SUaMmEjxVB2wga2-ogJNUM06d6CB-oVw=mo,"I don't know how I found this or if I just randomly downloaded it, but I don't regret it. I like how minimal it is. I like the random reminder settings. If you want a quick app that tracks emotions without anything extra like pets or plants or storyline this is for you. I personally gravitate towards this because it doesn't feel like a chore to check in. It's a quick ""whatchu feeling, where, and why?"" It has so many emotions and descriptions of it so you can tune into exactly what you feel. 🩵🩵",5,2,,2024-08-28 18:40:49,"Thank you for the encouraging words! Please recommend our app to your friends, and don’t hesitate to shoot us a note at support@howwefeel.org if you have any questions.",2024-09-11 18:14:13,
471923bb-8112-4fe5-808d-bf251ab766c9,Nikita Dawn,https://play-lh.googleusercontent.com/a/ACg8ocLgQv3Z1pWlTEv08Ftr3dgp1HEnNAX0ipmGMwAMWquZaV3_uQ=mo,"This app is amazing, 5 stars isn't enough for this. How We Feel has really helped me identify feelings and given me tools to help me.",5,1,0.0.342,2024-08-28 09:22:36,"Thank you for the encouraging words! Please recommend our app to your friends, and don’t hesitate to shoot us a note at support@howwefeel.org if you have any questions.",2024-09-11 18:16:19,0.0.342
2b363ebf-d71e-46e5-ba3a-f2f757397209,Dominic “Lurch” Smedley,https://play-lh.googleusercontent.com/a-/ALV-UjWWHMuKlb1slQyqsxD7EDo4SO_KbLpUxWP_cGlas-iZdElEZS9fqA,"Beautiful little app, well designed and easy to use. Very useful in keeping track of how you feel, identifying emotions. Each emotion have its own shape is a nice touch.",5,0,0.0.342,2024-08-28 05:31:26,"Thank you for the encouraging words! Please recommend our app to your friends, and don’t hesitate to shoot us a note at support@howwefeel.org if you have any questions.",2024-09-11 18:16:33,0.0.342
827bb6f7-e0d2-414c-8824-3ae7204b9b09,Kimmy Rarity,https://play-lh.googleusercontent.com/a-/ALV-UjVS8fjrDcYw8c56fRfjmL9m8mYQ9F_NxB7-sgNqT0gxUih_96ro,This is a wonderful app. The design is intuitive and simple. Check ins are easy and guide the user. Vibrant colors and shapes make this app fun and easy to understand. This is a wonderful app and its amazing its free to use. Everyone should use this app!!,5,1,0.0.342,2024-08-27 23:12:31,"Thank you for the encouraging words! Please recommend our app to your friends, and don’t hesitate to shoot us a note at support@howwefeel.org if you have any questions.",2024-09-11 18:16:52,0.0.342
42af39c0-3318-416e-ac49-9e9b08891c91,Patrick Nolasco,https://play-lh.googleusercontent.com/a/ACg8ocLCKST9WQhTQTrc0ANAL973mK6FUyjGfMx0xG_ZhIu9lI0zgw=mo,"Wow! This is like the best app for tracking your moods or if u want it to be a mini journal. Every update the app keeps getting better like fr. Thanks for adding support for the Health Connect API! (developers are sleeping on this api fr). That makes it less tedious to sync my sleep and steps data. One feature request tho. In the breathing feature, I think it would be great if there's a sound feedback on when to inhale, hold, or exhale—Just like in the Samsung Health app.",5,6,0.0.342,2024-08-27 22:02:55,Thank you for your feedback! We are working on such a feature.,2024-09-11 18:17:25,0.0.342
112d0785-2bdb-48f0-a8c4-e7b002467d94,Rhiannon Williams,https://play-lh.googleusercontent.com/a/ACg8ocJhOzr5u5P-jt6HZf6BteQdCugYlGti0-kWNIY3ECn5GgqKVMIf=mo,"I LOVE this app. The fact that nothing is hidden behind a paywall is amazing. The content, user interface and usability is just 10/10. Highly recommend this app.",5,1,0.0.335,2024-08-26 20:20:46,"Thank you for the encouraging words! Please recommend our app to your friends, and don’t hesitate to shoot us a note at support@howwefeel.org if you have any questions.",2024-09-11 18:17:54,0.0.335
a074bcc6-f3d5-467d-815e-fce4906653f5,Naledi Modise,https://play-lh.googleusercontent.com/a-/ALV-UjU4ejK4lnHKSw268gozUIDUfzQf3xf9JBkh4Bvhs0EaaQNg7pFU,Phenomenal,5,0,0.0.342,2024-08-26 18:27:32,"Thank you for the encouraging words! Please recommend our app to your friends, and don’t hesitate to shoot us a note at support@howwefeel.org if you have any questions.",2024-09-11 18:18:00,0.0.342
83dfb7b3-ddb4-4c7c-9975-c3e8cd2598de,Sophia Mc,https://play-lh.googleusercontent.com/a/ACg8ocJjtpsTeD6Zlk_t5icp9Vvq7GEdmkGL-e9jiB9A2-kBzdOyfA=mo,"It's a great start, but I'd really love to see some of the breakdowns done in a more helpful way. The data analysis they have for individual categories isn't really helpful for determining patterns of feelings... But it's great foe a birds eye view.",3,6,0.0.335,2024-08-26 11:59:33,Thank you for your feedback! We are working on such a feature.,2024-09-11 18:18:43,0.0.335
ba71b4d3-a8d8-47fe-9e6d-c690c8fce8de,Kodi “Kix” Henry,https://play-lh.googleusercontent.com/a-/ALV-UjVTHm5d1DO4L4LQzuge8oiWCTIM160J2MGTq6gimX-hHIYAk6UnnQ,I really like learning about my emotions and better ways to combat them or make them work to my benefit it's really good for those who have a lot of anxiety or mental instability I don't want to work through that,5,0,0.0.340,2024-08-23 20:57:57,,,0.0.340
7b766bba-1cd5-46a0-ba22-082cec7659e6,Angel Baby,https://play-lh.googleusercontent.com/a-/ALV-UjXSncB5XKPI7LSULuu-Fi1i_V8kVJIbONiF--nwI9O5H41WCWEqjg,"I'll admit I was surprised when I saw how much information this app is giving you for FREE. I'm going to keep using it. I would like to tell the devs that the blonde haired lady is very calming so if she would be open to making more videos, I bet a lot of people would appreciate it. She also had the most informative and helpful segments for me. The lady with black hair was also very informative. I would love to hear more from them especially. Thank you for offering such a great app for free!!",5,0,0.0.335,2024-08-22 14:55:38,,,0.0.335
7d35986c-0acb-4f78-b0bf-65a7ab76f565,K.L Lynch (MsMozzy),https://play-lh.googleusercontent.com/a-/ALV-UjVTJWeET0tPA50D80XzjtozRd3giqnC6dEVlE9oQNic0NqGEJ7A,I really like the concept and access to this app. I don't use it as much as I could. However I really want to keep the ability to be able to use it when I'm at my worst.,5,0,0.0.335,2024-08-22 08:59:10,,,0.0.335
ddd8cb05-b673-4502-a6cb-deb65586dfc5,Mai Curott,https://play-lh.googleusercontent.com/a/ACg8ocLmtPSx_m702na0ItNXQ2VGAwDcAU0nGkUd0YDURZBJ4iCSGg=mo,Does anyone know if there's a way to rename daily reminders?,5,0,0.0.335,2024-08-22 03:09:20,,,0.0.335
